<?xml version="1.0" encoding="utf-8"?>
<users xmlns:xsi="http://www.w3.org/2001/XMLSchema-instance" xsi:noNamespaceSchemaLocation="xsd/users.xsd">
    <user role="admin">
        <id>00001</id>
        <name>
            <first>Juan</first>
            <middle>H.</middle>
            <last>Kim</last>
        </name>
        <email>sample@sample.com</email>
        <account>
            <username>jhkim112</username>
            <password>$2y$10$d.O603MP5dg4rade7F29/.mCwxs3aOyWteLAFkESFw4RMbRlMmFPC</password>
        </account>
    </user>
    <user role="user">
        <id>00002</id>
        <name>
            <first>John</first>
            <middle>Huan</middle>
            <last>Kopp</last>
        </name>
        <email>sample@sample.com</email>
        <account>
            <username>jhkopp65</username>
            <password>$2y$10$tRSLNKON4cMftTb79GYLve7vc/L/MBshejmke8kyolpps3KrQNWAW</password>
        </account>
    </user>
    <user role="user">
        <id>00003</id>
        <name>
            <first>Mister</first>
            <middle>Gentle</middle>
            <last>Man</last>
        </name>
        <email>sample@sample.com</email>
        <account>
            <username>mistergentle</username>
            <password>$2y$10$roWOERrPAx6UKG/YqfYivOLmpPhG5SGB3Um9grrW.5dnSJdQxymuK</password>
        </account>
    </user>
</users>
